ID,Text,Comment
AnalyticsConsent.Agree,"Sí, accepto",
AnalyticsConsent.Disagree,"No, no estic d'acord",
AnalyticsConsent.Header,Dades de joc,Header of the panel that allows the player to consent to sending user data to the developers.
AnalyticsConsent.Info,"Si us plau, ajuda'ns a millorar el joc compartint dades sobre com jugues a Timberborn.

Si estàs d'acord, recopilarem automàticament informació relacionada amb la jugabilitat durant les teves sessions de joc.

Pots anar a la configuració del joc per retirar el teu consentiment i eliminar les teves dades en qualsevol moment. Per obtenir més informació, consulta la nostra <link><u>política de privacitat</u></link>.

Gràcies!",
Attractions.LoadRate,Popularitat,Header above a panel showing how popular an attraction is in each hour during the day
Attractions.Visitors,Visitants,"A header above a list of beavers visiting an attraction, such as a campfire."
Attractions.VisitorsLimit,Visitants: {0},{0} stands for capacity. Tells players the max capacity of the attraction in a shorter way
Automation.Api.OpenBrowser,Obre el navegador,A button which opens the web browser.
Automation.Api.Port,Port,Port as in the port number of a web server.
Automation.Api.StartApi,Inicia l'API,A button which starts the game's API. You may likely want to keep the term API in other languages.
Automation.Api.StopApi,Atura l'API,A button which stop the game's API. You may likely want to keep the term API in other languages.
Automation.Api.UnsafeWebhooksWarning,En iniciar l'API s'activaran webhooks que criden serveis externs:,This is an important safety warning so please make sure it is understandable. The message is followed by a list of web addresses.
Automation.Api.UnsafeWebhooksWarning.IUnderstandTheRisk,Entenc el risc,
Automation.Automate,Automatitza,This is for a button which adds automation to a building. Must be consistent with Automation.Automation.
Automation.Automation,Automatització,This is a collective name for the automation system and a set of buildings in the game which allow players to automate many processes.
Automation.AutomationNone,Cap,Dropdown value when no automation is selected
Automation.AutomationOptional,Opcional,Dropdown value when no automation is selected but it is optional
Automation.NoAutomation,Sense automatització,Dropdown value when no automation is selected
Automation.Input.A,A,"This should be one character, optionally two if you really need it. Those are labels preceding dropdowns for selecting input A and input B."
Automation.Input.B,B,"This should be one character, optionally two if you really need it. Those are labels preceding dropdowns for selecting input A and input B."
Automation.Input.Reset,RST,"Abbreviation for Reset, it should correspond to Automation.ResetButton. Three characters are OK for narrow letters but CJK and other languages with wider characters should be at most two - please let us know if it's a problem. It's likely that 'RST' is the best option in all languages because it is a very common abbreviation in electronics and schematics."
Automation.Measurement,Mesura: {0},Label for the measurement value in the automation panel. {0} is a measured value.
Automation.Mode,Mode,Keep short. This is a label for a dropdown in which select a mode of operation for different automation buildings.
Automation.Mode.Automated,Automàtic,"A mode in a dropdown or a radio button which denotes that this building will be automated as opposed to manually controlled. Gender should be consistent with Automation.Mode. Please keep short, at most the width of 10 latin characters."
Automation.PausedByAutomation,Pausat per l'automatització.,Dropdown value when no automation is selected
Automation.Pinned,Fixat,Checkbox label - when something is pinned it is always visible in the HUD.
Automation.PinnedAlways,Sempre fixat,Must be consistent with Automation.Pinned.
Automation.PinnedWhenOn,Fixat quan està actiu,Must be consistent with Automation.Pinned. This mode means that something is pinned to the HUD only when in the ON state.
Automation.ResetButton,Reinicia,A text for a button which resets the logic memory of the selected element to zero. It's likely that 'Reset' is a good option in many languages.
Automation.ResetCircuitButton,Reinicia el circuit,A text for a button which resets the logic memory of all elements in this circuit to zero.
Automation.ResetsWhenResetInput,Es reinicia quan <YellowHighlight>{0}</YellowHighlight>.,A text appended to some of the other mode descriptions such as Timer.Mode.* or Memory.Mode.*. {0} is Automation.Input.ResetInput. This text is meant to explain that the RST input resets this element.
Automation.SelectTransmitter,Selecciona l'emissor,A description of a tool which allows player to select a building which sends an automation signal (a transmitter).
Automation.State.Error,Error,A state label when a signal has an error. Keep very short because the other states are 'On' and 'Off'.
Automation.State.Off,Apagat,A state label when a signal is switched off which is shown next to lightbulb icon.
Automation.State.On,Encès,A state label when a signal is switched on which is shown next to lightbulb icon.
Automation.State.Processing,Processant...,A state label when a signal is switched on which is shown next to lightbulb icon. This state indicates that the element is in the middle of processing new data.
Automation.Threshold,Llindar: {0},Label for the threshold value in the automation panel. {0} is a value being a threshold.
Automation.Usages,Usos: {0},As in the number of usages - how many objects use this one.
Autosave.Failure,L'autodesament ha fallat,Notification on top of the window when autosave failed. It disappears after 10 seconds
Autosave.FailureDueToFullDisk,L'autodesament ha fallat per falta d'espai al disc,Notification on top of the window when autosave failed. It disappears after 10 seconds
Autosave.Success,Autodesat,"Notification on top of the window when autosave succeeded. Keep short, it disappears after 2 seconds"
BatchControl.Distribution,Distribució,Title of the distribution panel
BatchControl.Housing,Habitatge,Tooltip of a tab allowing to manage housing buildings.
BatchControl.Mechanical,Energia,Tooltip of a tab allowing to manage mechanical buildings. Power must be the same as used in Mechanical.PowerInput and other Mechanical. keys.
BatchControl.Migration,Migració,Title of migration panel
BatchControl.NoDistrict,No hi ha cap districte seleccionat.,Shown when no district is selected on some batch control tabs
BatchControl.Population,Població,Tooltip of a tab allowing to manage population.
BatchControl.ShowInfo,Gestiona l'assentament,Button opening a window to view and manage multiple buildings and characters at once . Please keep short
BatchControl.Storage,Magatzematge,Tooltip of a tab allowing to manage warehouses.
BatchControl.Workplaces,Llocs de treball,Tooltip of a tab allowing to manage workplaces.
Beaver.Adult.TemplateName,Castor adult,
Beaver.Adulthood,Edat adulta,Next to a progress bar that shows when a baby beaver reaches adulthood.
Beaver.Age,Edat: {0},"{0} stands for number of days, for example 'Age: 5'."
Beaver.Child.TemplateName,Castor jove,
Beaver.DeadNameSuffix,(mort),Preceded by beaver name and age
Beaver.DiedOldAge,{0} ha mort de vell.,{0} stands for beaver name
Beaver.Employment,Ocupació,Header of a section that tells of how many and where beavers are working
Beaver.GrewUp,{0} ha crescut.,{0} stands for beaver name. A notification that a beaver achieved maturity.
Beaver.Homeless,Sense llar,Signifies that the beaver has no home
Beaver.HomelessPlural,Sense llar,Label before number of homeless beavers
Beaver.House,Viu a: {0},{0} stands for Building.DisplayName. Tells which type of building the beaver resides in.
Beaver.Launched,S'ha llançat {0}.,{0} stands for beaver name. A notification that a beaver has been launched in a plane.
Beaver.PluralDisplayName,Castors,
Beaver.Population.Adults,Adults,Label before number of adult beavers
Beaver.Population.Children,Joves,Label before number of kit beavers
Beaver.Population.Contaminated,Contaminats,Header of the list of beavers contaminated by badwater. Should be similar or same as Need.BadwaterContamination.DisplayName
Beaver.Population.ContaminatedAdults,Adults contaminats,"Label before number of adult beavers contaminated by badwater. ""Contaminated"" should be similar or same as Need.BadwaterContamination.DisplayName. Ideally all uses of the word contaminate/contamination/contaminated should be uniform across the project."
Beaver.Population.ContaminatedChildren,Joves contaminats,"Label before number of children beavers contaminated by badwater. ""Contaminated"" should be similar or same as Need.BadwaterContamination.DisplayName. Ideally all uses of the word contaminate/contamination/contaminated should be uniform across the project."
Beaver.Unemployed,Sense feina,"Signifies that the beaver has no job, singular"
Beaver.UnemployedPlural,Sense feina,"Used in population statistics, followed by the number of unemployed beavers"
Beaver.Workplace,Treballa a: {0},{0} stands for Building.DisplayName. Tells which type of building the beaver works in.
Bonus.CarryingCapacity,Capacitat de càrrega,How much stuff a unit can carry
Bonus.CuttingSuccessChance,Probabilitat de tala,Cutting chance when cutting down a tree
Bonus.GrowthSpeed,Velocitat de creixement,Speed at which young beavers grow up
Bonus.LifeExpectancy,Esperança de vida,The presumed length of beavers' life.
Bonus.MovementSpeed,Velocitat de moviment,"Describes how fast character can move (bonus to walking, running and swimming)."
Bonus.WorkingSpeed,Velocitat de treball,Speed at which the beavers work.
Bot.BeaversPerished,"Ni tan sols em facis començar amb els castors.
Ho tenien tot. Aire fresc, aigua neta.
Ara només en queda un record llunyà.","Text for a game over state, when all beavers have perished."
Bot.Created,S'ha creat {0}!,{0} stands for bot name. Notification that shows when production of a new bot finishes.
Bot.DeadNameSuffix,(destruït),Preceded by bot name and age
Bot.DeathMessage,{0} s'ha avariat.,{0} stands for bot name. Notification that shows when a bot breaks down completely (it's destroyed)
Bot.DisplayName.Folktails,Fustabot {0},{0} stands for a bot serial number. Name of bots from the Folktails faction. Named after the fact they are visibly made from wood.
Bot.DisplayName.IronTeeth,Ferrobot {0},{0} stands for a bot serial number. Name of bots from the Iron Teeth faction. Named after the fact they are visibly made from metal.
Bot.Durability,Durabilitat,Label before a progress bar showing amount of durability left
Bot.PluralDisplayName,Bots,"Bots are autonomous robots, who assist beavers in their everyday tasks. They are constructed in factories."
Bot.TemplateName,Bot,A bot is an animated anthropomorphic being which is created from inanimate matter. Timberborn bots are depicting beavers and are made of wood and metal.
Breeding.NutrientBringing,"Els nutrients els porten els transportistes, els aturats i els treballadors després de la jornada.","Haulers are the same as in Building.HaulingPost.Description, unemployed as in Beaver.UnemployedPlural, workers as in Work.WorkersLabel"
Breeding.NutrientsNeeded,Nutrients necessaris:,Followed by a list of nutrients needed to produce a new beaver in breeding facility
Breeding.Progress,Progrés de cria,Label inside a progress bar describing production progress of new beaver in breeding facility
BuilderPriorityTool.Description,"Fes servir aquesta eina per establir la prioritat de construcció, demolició i recollida de béns de les runes.",Rubble should be plural version of RecoveredGoodStack.DisplayName
BuilderPriorityTool.Tip,Fes clic en un element per establir-ne la prioritat o mantén premut el botó per seleccionar una àrea més gran.,
Building.AdvancedBreedingPod.Description,"Utilitza un procés de cria avançat per produir castors adults, amb ganes de posar-se a treballar.",Breeding should be the same as Building.BreedingPod.DisplayName
Building.AdvancedBreedingPod.DisplayName,Càpsula de cria avançada,
Building.AdvancedBreedingPod.FlavorDescription,La idea va sorgir quan un cadell va caure dins d'un calder ple d'extracte i va fer una estirada gegant després de beure-se'l tot.,"Extract must be the same as Good.Extract.DisplayName, kit is a young beaver."
Building.Agora.Description,Un gran punt de trobada on els castors poden debatre temes relacionats amb la fusta.,
Building.Agora.DisplayName,Àgora,
Building.Agora.FlavorDescription,"Quan s'encenen els fars verds, és el senyal perquè els Cuesfusta es reuneixin.",Folktails must be same as faction as Faction.Folktails.DisplayName.
Building.AncientAquiferDrill.DisplayName,Perforadora d'aqüífers antiga,
Building.AncientAquiferDrill.FlavorDescription,L'últim intent desesperat dels humans per recuperar el que s'havia perdut.,
Building.AquaticFarmhouse.Description,Dona feina a pagesos especialitzats per plantar i collir conreus <YellowHighlight>Aquàtics</YellowHighlight>.,"Aquatic is a keyword, must be the same as in NaturalResources.Aquatic."
Building.AquaticFarmhouse.DisplayName,Granja Aquàtica,A farmhouse that specializes in water plants.
Building.AquaticFarmhouse.FlavorDescription,"""Una vegada va córrer el rumor que mengem peix. Fastigós!"" —Ma' Ngonel","Beavers eating fish is a common misconception. Beavers are 100% herbivores. Ma' Ngonel is an almost legendary figure - a beaver grandma, known for her stern hand, cooking skills and respect among both kits and adult beavers. Her name is an inside joke, as our community constantly demands an addition of catapults, mangonels etc."
Building.Aquifer.Description,Una font subterrània d'aigua.,
Building.Aquifer.DisplayName,Aqüífer,
Building.Aquifer.FlavorDescription,No és difícil de trobar quan és tan sorollós.,
Building.AquiferDrill.Description,Extreu aigua d'un aqüífer.,
Building.AquiferDrill.DisplayName,Perforadora d'aqüífers,
Building.AquiferDrill.FlavorDescription,"A diferència dels castors, està fet per deixar passar l'aigua.",
Building.BadtideDrain.Description,Expulsa aigua tòxica durant una Marea Tòxica.,
Building.BadtideDrain.DisplayName,Desguàs de Marea Tòxica,
Building.BadtideDrain.FlavorDescription,"""Això és per al que els humans feien servir canonades? Ugh."" —Pina.","Pina is a younger beaver figure that's exploring the world and isn't related to any faction in particular. Pina as a name relates to the pine tree, the translated name shouldn't suggest a gender if possible."
Building.BadwaterDischarge.Description,"Segella una Font d'aigua tòxica. Es pot obrir o tancar. Quan és oberta, l'aigua tòxica flueix fins i tot durant les sequeres.","Badwater Source must be the same as Building.BadwaterSource.DisplayName, Badwater must be the same as Good.Badwater.DisplayName."
Building.BadwaterDischarge.DisplayName,Desguàs d'aigua tòxica,"Name of the building that can either stop flow of badwater or enforce flow with full power. It's a dome shaped, mechanical building that opens and closes like a camera shutter. Badwater must be the same as Good.Badwater.DisplayName."
Building.BadwaterDischarge.FlavorDescription,Només s'hi permet l'accés a autèntics enginyers civils.,This is a reference to a youtuber called Real Civil Engineer.
Building.BadwaterDome.Description,Segella una Font d'aigua tòxica. Es pot obrir o tancar quan vulguis.,"Badwater Source must be the same as Building.BadwaterSource.DisplayName, Badwater must be the same as Good.Badwater.DisplayName."
Building.BadwaterDome.DisplayName,Cúpula d'aigua tòxica,Name of the building that stops flow of badwater when put on its source. It's a dome shaped mechanical building that can open and close by raising the cover up and down. Badwater must be the same as Good.Badwater.DisplayName.
Building.BadwaterDome.FlavorDescription,Si no hi ha aigua tòxica no hi ha plors.,"This is a reference to a Bob Marley song ""No woman, no cry""."
Building.BadwaterPump.Description,Una bomba reforçada capaç d'extreure aigua tòxica. La baixa contaminació d'aigua tòxica en redueix la velocitat de bombeig.,Badwater should be the same as Good.Badwater.DisplayName. Ideally all uses of the word contaminate/contamination/contaminated should be uniform across the project.
Building.BadwaterPump.DisplayName,Bomba d'aigua tòxica,Badwater should be the same as Good.Badwater.DisplayName.
Building.BadwaterPump.FlavorDescription,"""Tant de bo les mesures de protecció addicionals incloguessin taps pel nas."" —Suli",Suli is a younger beaver that likes to play tricks on their fellow beavers and isn't related to any faction in particular. Translated name shouldn't suggest a gender if possible.
Building.BadwaterRig.Description,Segella una Font d'aigua tòxica. Dona feina a treballadors que extreuen aigua tòxica directament de la font.,"Badwater Source must be the same as Building.BadwaterSource.DisplayName, Badwater must be the same as Good.Badwater.DisplayName."
Building.BadwaterRig.DisplayName,Plataforma d'extracció d'aigua tòxica,Name of the building that stops flow from badwater source and generates Good.Badwater.DisplayName goods (by extracting them from source). It's a mechanical building that needs workers to operate. Badwater must be the same as Good.Badwater.DisplayName
Building.BadwaterRig.FlavorDescription,Els que treballen sobre una font d'aigua tòxica bullent senten una pressió constant.,Play on words with pressure referring to both water pressure and stress. If possible try to adapt the phrase to fit your language.
Building.BadwaterSeep.Description,Una font d'aigua tòxica amb pressió limitada.,
Building.BadwaterSeep.DisplayName,Filtració d'aigua tòxica,"A building that allows badwater to seep through, creating a natural badwater source."
Building.BadwaterSeep.FlavorDescription,Pressió limitada, perills il·limitats.
Building.BadwaterSource.DisplayName,Font d'aigua tòxica,A crack or spring in the ground spuming badwater. Badwater should be the same as Good.Badwater.DisplayName.
Building.BadwaterSource.FlavorDescription,"""Per què hem de netejar el desastre dels humans? Ah, és clar, són tots morts."" —Pina",
Building.Bakery.Description,Enforna pa i brioixeria amb diferents farines.,Pastry being a baked good.
Building.Bakery.DisplayName,Fleca,Building that bakes bread
Building.Bakery.FlavorDescription,"""No hi ha res com un panet calent amb una mica de serradures per sobre."" —Ma' Ngonel","Ma' Ngonel is an almost legendary figure - a beaver grandma, known for her stern hand, cooking skills and respect among both kits and adult beavers. Her name is an inside joke, as our community constantly demands an addition of catapults, mangonels etc."
Building.Barrack.Description,Habitatge compartit i pràctic.,
Building.Barrack.DisplayName,Barraca,Barracks are cramped homes for beavers. Not related to soldiers.
Building.Barrack.FlavorDescription,"""Dos cuesfusta entren en una barraca."" —acudit de dents de ferro","Reference to 'walk into a bar' jokes; only Iron Teeth use Barracks, as Folktails prefer different lodges and are less work-focused than Iron Teeth"
Building.BeaverBust.Description,Un bust d'un castor d'aspecte important.,
Building.BeaverBust.DisplayName,Bust de castor,
Building.BeaverBust.FlavorDescription,Als cadells entremaliats els agrada afegir detalls a la cara d'Ol' Kazko.,"Ol' Kazko is a legendary forefather of modern beavers, famous inventor, pioneer of rapid industrialization. Kits are young beavers."
Building.BeaverStatue.Description.Folktails,Una estàtua d'un castor ben alimentat.,
Building.BeaverStatue.Description.IronTeeth,Una estàtua d'un castor treballador.,
Building.BeaverStatue.DisplayName,Estàtua de castor,Statue of a beaver
Building.BeaverStatue.FlavorDescription.Folktails,Et fa sentir orgull als bons anys i gana als dolents.,The statue shows a beaver with a full belly so it can make one hungry when looking at it.
Building.BeaverStatue.FlavorDescription.IronTeeth,El disseny original amb falç es va considerar massa estil Cuesfusta.,This metal statue depicts a beaver worker with a raised hammer. Hammer and sickle is an emblem of Soviet Russia. Folktails must be same as faction name (Faction.Folktails.DisplayName).
Building.Beehive.Description,Impulsa el creixement dels conreus propers.,
Building.Beehive.DisplayName,Aviram,
Building.Beehive.FlavorDescription,"""Al final t'acostumes al brunzit."" —Ma' Ngonel","Ma' Ngonel is an almost legendary figure - a beaver grandma, known for her stern hand, cooking skills and respect among both kits and adult beavers. Her name is an inside joke, as our community constantly demands an addition of catapults, mangonels etc."
Building.Bell.Description,Toca a l'inici i al final de la jornada laboral.,This is a large metal bell that rings twice a day.
Building.Bell.DisplayName,Campana,A large metal bell
Building.Bell.FlavorDescription,"""El toc del matí és el que has d'esperar amb ganes."" —Ol' Kazko","Ol' Kazko is a legendary forefather of modern beavers, famous inventor, pioneer of rapid industrialization."
Building.Bench.DisplayName,Banc,
Building.Bench.FlavorDescription,"De tant en tant, algun vàndal menja a la propietat pública.",
Building.Blockage.Description,Una barrera natural que bloqueja l'aigua. Es pot demolir.,Demolished meaning removed by a worker.
Building.Blockage.DisplayName,Obstrucció,"Not a dam since that's another building in game but if not possible it could be called a Natural Dam. Visually, it's a block made out of twigs and loose stones."
Building.Blockage.FlavorDescription,És sorprenent que la natura creï coses a l'alçada de l'enginyeria castora.,
Building.BotAssembler.Description,Assembla bots autònoms per dur a terme tasques quotidianes.,Bots should be the same as Bot.PluralDisplayName
Building.BotAssembler.DisplayName,Assemblea de bots,A factory for assembling bots. Bot should be the same as Bot.TemplateName
Building.BotAssembler.FlavorDescription,"Tot va començar amb un simple ""i si avui no hagués de treballar?"" —Pina",
Building.BotPartFactory.Description,Fabrica components de bots.,Bot should be the same as Bot.TemplateName
Building.BotPartFactory.DisplayName,Fàbrica de components de bots,"A factory for creating bot parts, that are later assembled into full bots. Bot should be the same as Bot.TemplateName."
Building.BotPartFactory.FlavorDescription,"""Fet! Espera, què hi fa aquest cargol aquí?"" —Pina",
Building.Brazier.Description,Un foc intens contingut amb seguretat dins d'un recinte decoratiu.,
Building.Brazier.DisplayName,Braser,
Building.Brazier.FlavorDescription,"""Uau, això crema... en el bon sentit."" —Suli",Play on words with lit meaning both lit up and cool. If possible try to adapt the phrase to fit your language. Suli is a younger beaver that likes to play tricks on their fellow beavers and isn't related to any faction in particular. Translated name shouldn't suggest a gender if possible.
Building.BrazierOfBonding.DisplayName,Braser de la unió,A large brazier surrounded by statues of a beaver family
Building.BrazierOfBonding.FlavorDescription,"""Si no és per nosaltres, que sigui per les generacions futures."" —Ma' Ngonel","Ma' Ngonel is an almost legendary figure - a beaver grandma, known for her stern hand, cooking skills and respect among both kits and adult beavers. Her name is an inside joke, as our community constantly demands an addition of catapults, mangonels etc."
Building.BreedingPod.Description,"La manera preferida, i única, de reproduir-se dels Dents de Ferro.",Iron Teeth must be the same as the faction name (Faction.IronTeeth.DisplayName).
Building.BreedingPod.DisplayName,Càpsula de cria,
Building.BreedingPod.FlavorDescription,"""Els cadells són el nostre futur. En necessitem dotze més abans del mes vinent."" —Ol' Kazko","Ol' Kazko is a legendary forefather of modern beavers, famous inventor, pioneer of rapid industrialization."
Building.BuildersHut.Description,Ocupa constructors addicionals.,
Building.BuildersHut.DisplayName,Barraca dels constructors,
Building.BuildersHut.FlavorDescription,Castoroma no es va construir en un dia. La llegenda diu que en sis hores.,Beaverome is a mythical beaver city built by beavers of many different factions who banded together to work on timbertech for the greater good of all beavers.
Building.BulletinPole.Description,Un pal decoratiu per a missatges públics.,
Building.BulletinPole.DisplayName,Pal de butlletins,
Building.BulletinPole.FlavorDescription,T'has lesionat a la feina? Potser tens dret a compensació! Contacta amb Suli.,Reference to common compensation scam text. Suli is a younger beaver that likes to play tricks on their fellow beavers and isn't related to any faction in particular. Translated name shouldn't suggest a gender if possible.
Building.Campfire.Description,Un lloc perquè els castors es relaxin i socialitzin al vespre.,
Building.Campfire.DisplayName,Foguera,
Building.Campfire.FlavorDescription,"De vegades, foc i fusta fan bona parella.",
Building.Carousel.Description,Un carrusel de fusta per a castors de totes les edats.,
Building.Carousel.DisplayName,Carrusel,Alternative name: Merry-Go-Round
Building.Carousel.FlavorDescription,"""On creus que vas, cadell? Aquestes branques no es pelaran soles."" —Ma' Ngonel","Ma' Ngonel is an almost legendary figure - a beaver grandma, known for her stern hand, cooking skills and respect among both kits and adult beavers. Her name is an inside joke, as our community constantly demands an addition of catapults, mangonels etc."
Building.Centrifuge.Description,Maquinària pesada que transforma la perillosa aigua tòxica en extracte utilitzable.,Badwater should be the same as Good.Badwater.DisplayName. Extract should be the same as Good.Extract.DisplayName.
Building.Centrifuge.DisplayName,Centrifugadora,
